{
  "attributes": {
    "example.description": "Synthetic GPU-only monitor run"
  },
  "configuration": {
    "collector_interval_ns": 100000000
  },
  "created_at_unix_ns": 1784916000000000000,
  "devices": [
    {
      "attributes": {
        "nvidia.driver_version": "example"
      },
      "device_id": "gpu0",
      "device_type": "gpu",
      "host_id": "gpu-host",
      "memory_total_bytes": 102005473280,
      "model": "Example NVIDIA GPU",
      "status": "available",
      "vendor": "NVIDIA"
    }
  ],
  "hosts": [
    {
      "architecture": "x86_64",
      "host_id": "gpu-host",
      "hostname": "gpu-host-alias",
      "operating_system": "Linux",
      "role": "combined"
    }
  ],
  "mode": "gpu_only",
  "models": [
    {
      "dtype": "bfloat16",
      "model_id": "example/causal-lm",
      "revision": null,
      "role": "served",
      "tokenizer_id": "example/causal-lm"
    }
  ],
  "profile_mode": "monitor",
  "record_type": "run_manifest",
  "run_id": "example-gpu-only",
  "schema_version": "1.0.0",
  "software": [
    {
      "name": "Python",
      "path": null,
      "role": "runtime",
      "version": "3.10"
    },
    {
      "name": "vllm",
      "path": null,
      "role": "inference",
      "version": "example"
    }
  ],
  "status": "succeeded",
  "workload": {
    "concurrency": 1,
    "input_tokens": 16,
    "max_model_len": 4096,
    "output_tokens": 8,
    "request_count": 1,
    "request_rate_per_s": null,
    "warmup_requests": 1
  }
}
